{
  "schema_version": "0.1.0",
  "observation_id": "obs_7a2f9c1e4b8d6a0f3c5e2b9d8f1a4c6e",
  "observed_at": "2024-08-12T09:14:03+00:00",
  "recorded_at": "2024-08-12T09:14:05+00:00",
  "source": {
    "source_id": "src_local_eng_share",
    "connector": "local-folder",
    "connector_version": "0.1.0",
    "cursor": "scan:2024-08-12T09:14:00Z:seq:41"
  },
  "subject": {
    "kind": "file",
    "location": {
      "source_id": "src_local_eng_share",
      "locator": "engineering/widget/.gyst/project.yaml",
      "native_version": {
        "scheme": "mtime_size",
        "value": "1723420800:31"
      }
    },
    "version": {
      "content_digest": {
        "algo": "sha256",
        "hex": "9f54f1b98b6683e9c504dc8dfb4cccb2fc0c92bb9fbd3e3d65acb3964284716c"
      },
      "size_bytes": 31
    }
  },
  "claim": {
    "type": "project.manifest",
    "payload": {
      "valid": true,
      "id": "widget",
      "name": "Widget",
      "description": "",
      "members": [
        "**"
      ],
      "owners": null
    }
  },
  "extractor": {
    "name": "project-manifest",
    "version": "0.1.0",
    "output_schema": "gyst.claim.project.manifest/0.1.0",
    "warnings": [
      "id derived from name: widget"
    ],
    "confidence": 1.0
  },
  "policy": {
    "content_level": "fingerprint",
    "egress": "device",
    "effective_policy_version": "pol_2024-08-01_r3"
  },
  "visibility": {
    "labels": [
      "src:src_local_eng_share:read"
    ],
    "source_acl_complete": true
  }
}
